파주시,조리파출소,경기북부청,파주,파출소,10937,경기도 파주시 조리읍 봉일천리 171-6번지,경기도 파주시 조리읍 봉천로 55,37.7437571,126.805488
평택시,안중파출소,경기남부청,평택,파출소,17937,경기도 평택시 안중읍 현화리 823-3번지,경기도 평택시 안중읍 현화중앙길 71,36.9849968,126.9205505
평택시,청북파출소,경기남부청,평택,파출소,17812,경기도 평택시 청북읍 현곡리 291-7번지,경기도 평택시 청북읍 신포길 38,37.0395562,126.934317
평택시,만호파출소,경기남부청,평택,파출소,17959,경기도 평택시 포승읍 만호리 578-8번지,경기도 평택시 포승읍 평택항로 170,36.9741598,126.843723
평택시,오성파출소,경기남부청,평택,파출소,17819,경기도 평택시 오성면 숙성리 35-3번지,경기도 평택시 오성면 숙성시장길 71,37.0088754,126.9855454
평택시,고덕파출소,경기남부청,평택,파출소,17770,경기도 평택시 고덕면 좌교리 384-5번지 고덕파출소,경기도 평택시 고덕면 고덕로 297,37.0431251,127.0189786
평택시,비전파출소,경기남부청,평택,파출소,17887,경기도 평택시 비전동 819-1번지 비전파출소,경기도 평택시 평택5로 189,36.9962195,127.1029187
평택시,팽성파출소,경기남부청,평택,파출소,17990,경기도 평택시 팽성읍 객사리 47-3번지,경기도 평택시 팽성읍 동서촌로 93,36.9646371,127.0624525
평택시,진위파출소,경기남부청,평택,파출소,17706,경기도 평택시 진위면 하북리 138-8번지,경기도 평택시 진위면 경기대로 1865,37.1107535,127.0628142
평택시,서정지구대,경기남부청,평택,지구대,17779,경기도 평택시 서정동 332-35번지 서정지구대,경기도 평택시 서정역로 34,37.0570447,127.0560376
평택시,신장파출소,경기남부청,평택,파출소,17767,경기도 평택시 신장동 263-141번지,경기도 평택시 신서로 65,37.0723197,127.0512241
평택시,현덕파출소,경기남부청,평택,파출소,17946,경기도 평택시 현덕면 도대리 17-107번지,경기도 평택시 현덕면 안현로 144,36.9646852,126.9186298
평택시,송탄파출소,경기남부청,평택,파출소,17753,경기도 평택시 신장동 211-7번지,경기도 평택시 탄현로 331,37.0817067,127.0559761
평택시,포승파출소,경기남부청,평택,파출소,17965,경기도 평택시 포승읍 방림리 산73-4번지 포승파출소,경기도 평택시 포승읍 서동대로 1150,36.9822967,126.8820511
평택시,서탄파출소,경기남부청,평택,파출소,17704,경기도 평택시 서탄면 금암리 251-2번지,경기도 평택시 서탄면 서탄로 280,37.1080344,127.0338427
평택시,평택지구대,경기남부청,평택,지구대,17891,경기도 평택시 통복동 73-1번지 평택지구대,경기도 평택시 중앙1로 23,36.9982693,127.0855647
포천시,창수파출소,경기북부청,포천,파출소,11134,경기도 포천시 창수면 주원리 249-2번지,경기도 포천시 창수면 메치골로 174,37.9909016,127.1892677
포천시,관인파출소,경기북부청,포천,파출소,11101,경기도 포천시 관인면 탄동리 664-2번지,경기도 포천시 관인면 관인로 15,38.1572485,127.2504803
포천시,영북파출소,경기북부청,포천,파출소,11105,경기도 포천시 영북면 운천리 505-2번지,경기도 포천시 영북면 운천로 4,38.0915308,127.2738208
포천시,신북파출소,경기북부청,포천,파출소,11139,경기도 포천시 신북면 기지리 893-2번지,경기도 포천시 신북면 호국로 2059,37.933331,127.2264659
포천시,포천파출소,경기북부청,포천,파출소,11149,경기도 포천시 신읍동 106-22번지 포천파출소,경기도 포천시 원모루로1길 32,37.8924105,127.1961586
포천시,선단파출소,경기북부청,포천,파출소,11160,경기도 포천시 선단동 834-2번지,경기도 포천시 송선로 279,37.857169,127.1504436
포천시,소흘지구대,경기북부청,포천,지구대,,경기도 포천시 소흘읍 태봉로 144번길 소흘지구대,,,
포천시,화현파출소,경기북부청,포천,파출소,11123,경기도 포천시 화현면 화현리 810-19번지,경기도 포천시 화현면 화동로 327,37.8969745,127.301461
포천시,군내파출소,경기북부청,포천,파출소,11152,경기도 포천시 군내면 구읍리 214-3,경기도 포천시 군내면 청군로 3280,37.8875254,127.2181311
포천시,가산파출소,경기북부청,포천,파출소,11164,경기도 포천시 가산면 마산리 425-1번지,경기도 포천시 가산면 가산로309번길 13,37.846256,127.1846085
포천시,이동파출소,경기북부청,포천,파출소,11111,경기도 포천시 이동면 장암리 219-2번지,경기도 포천시 이동면 화동로 2078,38.0330919,127.3663104
포천시,영중파출소,경기북부청,포천,파출소,11129,경기도 포천시 영중면 양문리 847-7번지,경기도 포천시 영중면 양문로 109,38.0025436,127.2427636
포천시,일동파출소,경기북부청,포천,파출소,11120,경기도 포천시 일동면 기산리 285-6,경기도 포천시 일동면 화동로 1023,37.9550743,127.3156456
포천시,내촌파출소,경기북부청,포천,파출소,11189,경기도 포천시 내촌면 내리 389-3번지 내촌파출소,경기도 포천시 내촌면 내촌로 62,37.7854048,127.2272455
하남시,하남지구대,경기남부청,하남,지구대,12962,경기도 하남시 천현동 194-14번지,경기도 하남시 신장로 66,37.5355708,127.2102252
하남시,미사파출소,경기남부청,하남,파출소,12910,경기도 하남시 망월동 183-30번지 미사파출소,경기도 하남시 아리수로 567,37.5674278,127.1897583
하남시,서부파출소,경기남부청,하남,파출소,12990,경기도 하남시 감북동 327번지,경기도 하남시 감북로 43,37.5160671,127.1620986
하남시,덕풍지구대,경기남부청,하남,지구대,12972,경기도 하남시 덕풍동 산36-3번지 덕풍지구대,경기도 하남시 하남대로 911,37.5458183,127.1977271
화성시,안용파출소,경기남부청,화성동부,파출소,18362,경기도 화성시 안녕동 22번지,경기도 화성시 용주로32번길 4,37.2057474,127.0132568
화성시,비봉파출소,경기남부청,화성서부,파출소,18284,경기도 화성시 비봉면 양노리 255-3번지,경기도 화성시 비봉면 양노로 118,37.2368268,126.8742646
화성시,송산파출소,경기남부청,화성서부,파출소,18550,경기도 화성시 송산면 사강리 638-1,경기도 화성시 송산면 송산포도로 98,37.2140478,126.7381203
화성시,서신파출소,경기남부청,화성서부,파출소,18555,경기도 화성시 서신면 매화리 351-3번지,경기도 화성시 서신면 매화1길 31,37.170108,126.7055313
화성시,동탄2파출소,경기남부청,화성동부,파출소,18472,경기도 화성시 영천동 668-1번지,경기도 화성시 동탄영천로 70,37.2090116,127.1038635
화성시,동탄지구대,경기남부청,화성동부,지구대,18460,경기도 화성시 석우동 59-1번지,경기도 화성시 노작로 226-1,37.2072742,127.0773096
화성시,발안파출소,경기남부청,화성서부,파출소,18593,경기도 화성시 향남읍 평리 107번지,경기도 화성시 향남읍 3.1만세로 1095,37.1318868,126.9073485
화성시,남양파출소,경기남부청,화성서부,파출소,18258,경기도 화성시 남양읍 남양리 651-8번지,경기도 화성시 남양읍 남양시장로 47,37.2089771,126.8146175
화성시,양감파출소,경기남부청,화성서부,파출소,18634,경기도 화성시 양감면 신왕리 678-5번지 양감파출소,경기도 화성시 양감면 은행나무로 263,37.0815332,126.9448171
화성시,마도파출소,경기남부청,화성서부,파출소,18537,경기도 화성시 마도면 석교리 228-2,경기도 화성시 마도면 석교로 179,37.2061853,126.7744204
화성시,매송파출소,경기남부청,화성서부,파출소,18287,경기도 화성시 매송면 어천리 426-1번지,경기도 화성시 매송면 화성로 2249,37.2498455,126.9118999
화성시,팔탄파출소,경기남부청,화성서부,파출소,18527,경기도 화성시 팔탄면 구장리 529-5번지 팔탄파출소,경기도 화성시 팔탄면 서촌길 9,37.1604466,126.903271
화성시,우정파출소,경기남부청,화성서부,파출소,18567,경기도 화성시 우정읍 조암리 265-3번지,경기도 화성시 우정읍 조암남로 31,37.0840621,126.8184471
화성시,정남파출소,경기남부청,화성동부,파출소,18516,경기도 화성시 정남면 괘랑리 921-1번지,경기도 화성시 정남면 만년로 582,37.1729394,126.9839766
화성시,태안지구대,경기남부청,화성동부,지구대,18390,경기도 화성시 진안동 525-30번지,경기도 화성시 떡전골로 112-2,37.2083029,127.0332302
화성시,봉담파출소,경기남부청,화성서부,파출소,18321,경기도 화성시 봉담읍 와우리 214-1번지,경기도 화성시 봉담읍 와우로15번길 17,37.2165739,126.97057

