시흥시,신천파출소,경기남부청,시흥,파출소,14950,경기도 시흥시 신천동 772-24번지,경기도 시흥시 신천로100번안길 15,37.4375179,126.7867473
시흥시,매화파출소,경기남부청,시흥,파출소,14940,경기도 시흥시 매화동 202-1번지,경기도 시흥시 매화로 36,37.4162479,126.8146083
시흥시,대야파출소,경기남부청,시흥,파출소,14909,경기도 시흥시 대야동 494번지,경기도 시흥시 호현로 42,37.4442639,126.7853831
시흥시,정왕지구대,경기남부청,시흥,지구대,15055,경기도 시흥시 정왕동 1800-10번지 정왕지구대,경기도 시흥시 정왕신길로 216,37.3486672,126.7410003
시흥시,옥구지구대,경기남부청,시흥,지구대,15038,경기도 시흥시 정왕동 1849-7번지,경기도 시흥시 정왕대로118번길 1,37.351135,126.7286106
안산시,본오지구대,경기남부청,안산상록,지구대,15532,경기도 안산시 상록구 본오동 877-3번지,경기도 안산시 상록구 상록수로 12,37.3025958,126.8611027
안산시,신길파출소,경기남부청,안산단원,파출소,15403,경기도 안산시 단원구 신길동 1696번지,경기도 안산시 단원구 삼일로 42-13,37.3345266,126.7834657
안산시,원곡파출소,경기남부청,안산단원,파출소,15375,경기도 안산시 단원구 원곡동 753번지,경기도 안산시 단원구 원곡공원로 30,37.3325553,126.7945181
안산시,선부파출소,경기남부청,안산단원,파출소,15367,경기도 안산시 단원구 선부동 1072-5번지,경기도 안산시 단원구 선부광장1로 150,37.3319224,126.8091095
안산시,와동파출소,경기남부청,안산단원,파출소,15255,경기도 안산시 단원구 와동 109-9번지,경기도 안산시 단원구 와동로7길 1,37.3404477,126.8275495
안산시,대부파출소,경기남부청,안산단원,파출소,15645,경기도 안산시 단원구 대부북동 294-6번지,경기도 안산시 단원구 대부중앙로 67,37.2449535,126.5824903
안산시,팔곡파출소,경기남부청,안산상록,파출소,15528,경기도 안산시 상록구 팔곡이동 593-23번지,,37.296784,126.8856778
안산시,월피파출소,경기남부청,안산상록,파출소,15259,경기도 안산시 상록구 월피동 512-3번지,경기도 안산시 상록구 안산천서로 215,37.3330587,126.8463202
안산시,고잔파출소,경기남부청,안산단원,파출소,15335,경기도 안산시 단원구 고잔동 515번지,경기도 안산시 단원구 화랑로 397,37.3220367,126.8315185
안산시,성포파출소,경기남부청,안산상록,파출소,15291,경기도 안산시 상록구 성포동 593-18번지,경기도 안산시 상록구 예술광장로 47,37.3269511,126.8472919
안산시,부곡파출소,경기남부청,안산상록,파출소,,경기도 안산시 상록구  성호로18길 성호로 324 부곡파출소,,,
안산시,본오1파출소,경기남부청,안산상록,파출소,15575,경기도 안산시 상록구 본오동 1153-1번지 본오1파출소,경기도 안산시 상록구 샘골로 11,37.2848124,126.863459
안산시,수암파출소,경기남부청,안산상록,파출소,15202,경기도 안산시 상록구 수암동 502번지,경기도 안산시 상록구 수인로 2026,37.3639184,126.8763734
안산시,일동파출소,경기남부청,안산상록,파출소,15323,경기도 안산시 상록구 일동 600-6번지,경기도 안산시 상록구 호동로 118,37.312592,126.8643553
안산시,반월파출소,경기남부청,안산상록,파출소,15521,경기도 안산시 상록구 건건동 645-1번지,경기도 안산시 상록구 건건로 47,37.305395,126.9022116
안산시,사동지구대,경기남부청,안산상록,지구대,15582,경기도 안산시 상록구 사동 1304-1번지,경기도 안산시 상록구 석호로 175,37.296763,126.8512451
안산시,선부2파출소,경기남부청,안산단원,파출소,15220,경기도 안산시 단원구 선부동 703-3번지,경기도 안산시 단원구 선여불로 19,37.3440594,126.8038757
안산시,원선파출소,경기남부청,안산단원,파출소,15380,경기도 안산시 단원구 원곡동 821-3번지,경기도 안산시 단원구 원선로 33,37.3280009,126.797216
안산시,선부3파출소,경기남부청,안산단원,파출소,15212,경기도 안산시 단원구 선부동 1135번지,경기도 안산시 단원구 선삼로2길 14-20,37.3448666,126.8126086
안산시,공단파출소,경기남부청,안산단원,파출소,15433,경기도 안산시 단원구 원시동 773-6번지,경기도 안산시 단원구 동산로 29,37.3128119,126.7933543
안산시,호수지구대,경기남부청,안산단원,지구대,15473,경기도 안산시 단원구 고잔동 712-3번지,경기도 안산시 단원구 광덕2로 127,37.3101693,126.8247208
안성시,공도지구대,경기남부청,안성,지구대,17560,경기도 안성시 공도읍 만정리 793-2번지,경기도 안성시 공도읍 공도4로 4,37.0006636,127.1726677
안성시,일죽파출소,경기남부청,안성,파출소,17529,경기도 안성시 일죽면 송천리 20-6번지,경기도 안성시 일죽면 주래본죽로 28,37.0935727,127.4775513
안성시,원곡파출소,경기남부청,안성,파출소,17556,경기도 안성시 원곡면 외가천리 267-4번지,경기도 안성시 원곡면 가천중앙1길 44,37.0391303,127.1292205
안성시,금광파출소,경기남부청,안성,파출소,17535,경기도 안성시 금광면 금광리 93-5번지,경기도 안성시 금광면 금광초교길 38,37.0009669,127.3227268
안성시,대덕파출소,경기남부청,안성,파출소,17545,경기도 안성시 대덕면 건지리 420-4번지,경기도 안성시 대덕면 중앙로 78,37.0125826,127.237437
안성시,죽산파출소,경기남부청,안성,파출소,17519,경기도 안성시 죽산면 죽산리 432-7번지,경기도 안성시 죽산면 죽주로 241,37.0748511,127.4219729
안성시,중앙지구대,경기남부청,안성,지구대,17578,경기도 안성시 석정동 256-2번지,경기도 안성시 석정1길 15,37.0094409,127.2619548
안성시,양성파출소,경기남부청,안성,파출소,17502,경기도 안성시 양성면 동항리 291-3번지,경기도 안성시 양성면 장터길 35,37.0586847,127.1952716
안성시,보개파출소,경기남부청,안성,파출소,17509,경기도 안성시 보개면 불현리 42-9번지,경기도 안성시 보개면 보개원삼로 220-1,37.0224688,127.2900144
안양시,석수지구대,경기남부청,안양만안,지구대,13958,경기도 안양시 만안구 안양동 42-17번지 석수지구대,경기도 안양시 만안구 경수대로 1161,37.4146376,126.9183656
안양시,안양지구대,경기남부청,안양만안,지구대,13992,경기도 안양시 만안구 안양동 88-1번지,경기도 안양시 만안구 만안로 232,37.404944,126.9200368
안양시,갈산지구대,경기남부청,안양동안,지구대,14106,경기도 안양시 동안구 호계동 1118-1번지 갈산지구대,경기도 안양시 동안구 흥안대로223번길 30-1,37.3762251,126.9662001
안양시,평안파출소,경기남부청,안양동안,파출소,14068,경기도 안양시 동안구 평촌동 896-5번지 평안파출소,경기도 안양시 동안구 관평로138번길 43,37.3903614,126.9644542
안양시,범계파출소,경기남부청,안양동안,파출소,14072,경기도 안양시 동안구 호계동 1051-2번지 범계파출소,경기도 안양시 동안구 평촌대로217번길 57,37.3898074,126.9527896
안양시,박달지구대,경기남부청,안양만안,지구대,14008,경기도 안양시 만안구 박달동 94-136번지,경기도 안양시 만안구 박달로 492,37.4022762,126.9070967
안양시,인덕원지구대,경기남부청,안양동안,지구대,13943,경기도 안양시 동안구 관양동 1505번지,경기도 안양시 동안구 흥안대로 530,37.401168,126.9771995
안양시,호계파출소,경기남부청,안양동안,파출소,14123,경기도 안양시 동안구 호계동 1006-9번지,경기도 안양시 동안구 경수대로508번길 17,37.3681405,126.9588436
안양시,비산지구대,경기남부청,안양동안,지구대,13922,경기도 안양시 동안구 비산동 459-57번지,경기도 안양시 동안구 관악대로 125,37.3990265,126.9379211
안양시,명학지구대,경기남부청,안양만안,지구대,14033,경기도 안양시 만안구 안양동 441-1번지 명학지구대,경기도 안양시 만안구 안양로170번길 20,37.3895256,126.9304764
양주시,광적파출소,경기북부청,양주,파출소,11419,경기도 양주시 광적면 가납리 741-22번지,경기도 양주시 광적면 가래비길 54,37.8233399,126.9862084
양주시,고읍파출소,경기북부청,양주,파출소,11493,경기도 양주시 만송동 695-3번지,경기도 양주시 고읍로 83,37.7964221,127.0807578
양주시,덕계파출소,경기북부청,양주,파출소,11442,경기도 양주시 덕계동 681-31번지,경기도 양주시 평화로 1427,37.8181979,127.0456757
양주시,백석파출소,경기북부청,양주,파출소,11504,경기도 양주시 백석읍 오산리 36-5번지,경기도 양주시 백석읍 꿈나무로 142,37.7964201,126.9904608
양주시,주내파출소,경기북부청,양주,파출소,11496,경기도 양주시 마전동 163-3,경기도 양주시 부흥로 1613,37.7790676,127.0512606
양주시,장흥파출소,경기북부청,양주,파출소,11520,경기도 양주시 장흥면 일영리 139-4번지,경기도 양주시 장흥면 호국로 179,37.7169313,126.9408088
양주시,남면파출소,경기북부청,양주,파출소,11404,경기도 양주시 남면 신산리 285-183번지,경기도 양주시 남면 개나리길 50,37.8951873,126.9740956
양주시,은현파출소,경기북부청,양주,파출소,11427,경기도 양주시 은현면 선암리 336-3번지,경기도 양주시 은현면 은현로55번길 6,37.8740532,127.0232379
양주시,회천지구대,경기북부청,양주,지구대,11451,경기도 양주시 덕정동 206-3번지,경기도 양주시 회정로 133,37.837585,127.0679527
양평군,양동파출소,경기남부청,양평,파출소,12539,경기도 양평군 양동면 쌍학리 228-5번지,경기도 양평군 양동면 학둔지아래길 72,37.4204249,127.752895
양평군,양서파출소,경기남부청,양평,파출소,12585,경기도 양평군 양서면 양수리 559-6번지,경기도 양평군 양서면 양수로152번길 6,37.5447626,127.3191853
양평군,옥천파출소,경기남부청,양평,파출소,12507,경기도 양평군 옥천면 옥천리 746-2번지,경기도 양평군 옥천면 옥천길 27,37.5183563,127.4568705
양평군,단월파출소,경기남부청,양평,파출소,12529,경기도 양평군 단월면 보룡리 92-1번지,경기도 양평군 단월면 재인동길 2-6,37.5328533,127.6742929
양평군,지평파출소,경기남부청,양평,파출소,12541,경기도 양평군 지평면 지평리 539번지,경기도 양평군 지평면 지평의병로 91,37.4752483,127.636132
양평군,개군파출소,경기남부청,양평,파출소,12568,경기도 양평군 개군면 하자포리 223-1번지,경기도 양평군 개군면 하자포길 25,37.4252876,127.5378642
양평군,용문파출소,경기남부청,양평,파출소,12521,경기도 양평군 용문면 다문리 720-1번지,경기도 양평군 용문면 용문로 351,37.4840589,127.5928018
양평군,청운파출소,경기남부청,양평,파출소,12530,경기도 양평군 청운면 용두리 659-3번지,경기도 양평군 청운면 용두로 140,37.5541047,127.7087054
양평군,강하파출소,경기남부청,양평,파출소,12574,경기도 양평군 강하면 운심리 34-4번지,경기도 양평군 강하면 운심길 46,37.4958274,127.4111286
양평군,양근파출소,경기남부청,양평,파출소,12555,경기도 양평군 양평읍 양근리 280번지,경기도 양평군 양평읍 해오름길 11,37.4881114,127.4904838
양평군,강상파출소,경기남부청,양평,파출소,12572,경기도 양평군 강상면 교평리 449-7번지,경기도 양평군 강상면 양평대교길 91,37.4821606,127.4849504
양평군,서종파출소,경기남부청,양평,파출소,12503,경기도 양평군 서종면 문호리 779-2번지,경기도 양평군 서종면 무내미길 45,37.6032068,127.3519561
여주시,점동파출소,경기남부청,여주,파출소,12667,경기도 여주시 점동면 청안리 128-2번지,경기도 여주시 점동면 청안로 118,37.2049523,127.6616674
여주시,흥천파출소,경기남부청,여주,파출소,12607,경기도 여주시 흥천면 효지리 376-23번지,경기도 여주시 흥천면 효자로 144,37.3326255,127.5425323
여주시,대신파출소,경기남부청,여주,파출소,12610,경기도 여주시 대신면 율촌리 283-2번지,경기도 여주시 대신면 여양로 1436,37.3750967,127.5884475
여주시,북내파출소,경기남부청,여주,파출소,12613,경기도 여주시 북내면 당우리 161-1번지,경기도 여주시 북내면 여양2로 300,37.3293254,127.67971
여주시,홍문지구대,경기남부청,여주,지구대,12622,경기도 여주시 홍문동 15-2번지,경기도 여주시 세종로 2,37.2974962,127.6368043
여주시,산북파출소,경기남부청,여주,파출소,12603,경기도 여주시 산북면 상품리 27-6번지,경기도 여주시 산북면 금품1로 2,37.4047283,127.4436247
여주시,능서파출소,경기남부청,여주,파출소,12641,경기도 여주시 능서면 번도리 499-39번지,경기도 여주시 능서면 마장로 61,37.2991858,127.5720574
여주시,가남파출소,경기남부청,여주,파출소,12662,경기도 여주시 가남읍 태평리 176번지,경기도 여주시 가남읍 태평2길 23,37.2037308,127.5453981
여주시,금사파출소,경기남부청,여주,파출소,12604,경기도 여주시 금사면 이포리 198번지 금사파출소,경기도 여주시 금사면 이포로 41,37.3930669,127.5341119
여주시,강천파출소,경기남부청,여주,파출소,12616,경기도 여주시 강천면 간매리 313번지,경기도 여주시 강천면 강문로 566,37.2735863,127.7109939
연천군,백학파출소,경기북부청,연천,파출소,11048,경기도 연천군 백학면 두일리 367-3번지,경기도 연천군 백학면 청정로 534-1,38.0305321,126.9171275
연천군,왕징파출소,경기북부청,연천,파출소,,경기도 연천군 미산면 왕산로28번길 왕징파출소,,,
연천군,청산파출소,경기북부청,연천,파출소,11023,경기도 연천군 청산면 초성리 187-7번지,경기도 연천군 청산면 평화로 229,37.9939582,127.0697527
연천군,군남파출소,경기북부청,연천,파출소,11006,경기도 연천군 군남면 삼거리 400-16,경기도 연천군 군남면 군남로 413-6,38.0844996,127.0187026
연천군,연천파출소,경기북부청,연천,파출소,11012,경기도 연천군 연천읍 차탄리 649번지 (차탄리649번지),경기도 연천군 연천읍 문화로 67-1,38.0995583,127.077282
연천군,신서파출소,경기북부청,연천,파출소,11000,경기도 연천군 신서면 도신리 285-11번지,경기도 연천군 신서면 연신로 1153,38.1846791,127.1070558
연천군,전곡파출소,경기북부청,연천,파출소,11037,경기도 연천군 전곡읍 전곡리 333-608번지 전곡파출소,경기도 연천군 전곡읍 전곡역로 72,38.0246156,127.0710333
오산시,오산지구대,경기남부청,화성동부,지구대,18139,경기도 오산시 원동 813-13번지,경기도 오산시 운암로 11,37.1472837,127.0759226
오산시,중앙파출소,경기남부청,화성동부,파출소,18137,경기도 오산시 오산동 903-3번지,경기도 오산시 역광장로 70,37.1466936,127.0679415
오산시,궐동파출소,경기남부청,화성동부,파출소,18115,경기도 오산시 궐동 13-7번지,경기도 오산시 오산로 371,37.1596427,127.0661176
오산시,세교파출소,경기남부청,화성동부,파출소,18106,경기도 오산시 세교동 617-2번지,경기도 오산시 세마역로 5,37.1810522,127.0439511
용인시,상현지구대,경기남부청,용인서부,지구대,,경기도 용인시 수지구  심곡로 7번길,,,
용인시,수지지구대,경기남부청,용인서부,지구대,16833,경기도 용인시 수지구 풍덕천동 77-1번지,경기도 용인시 수지구 풍덕천로190번길 18,37.3248405,127.101852
용인시,보라파출소,경기남부청,용인동부,파출소,17080,경기도 용인시 기흥구 보라동 609-2번지,경기도 용인시 기흥구 한보라1로 42-3,37.2512929,127.1087441
용인시,동부파출소,경기남부청,용인동부,파출소,17154,경기도 용인시 처인구 마평동 858-5번지,경기도 용인시 처인구 경안천로 16,37.2345519,127.210649
용인시,백암파출소,경기남부청,용인동부,파출소,17178,경기도 용인시 처인구 백암면 백암리 459-3번지,경기도 용인시 처인구 백암면 백암로201번길 9,37.164422,127.3738863
용인시,양지파출소,경기남부청,용인동부,파출소,17158,경기도 용인시 처인구 양지면 양지리 445-3번지,경기도 용인시 처인구 양지면 양지로 165,37.2342497,127.2867812
용인시,이동파출소,경기남부청,용인동부,파출소,17136,경기도 용인시 처인구 이동면 송전리 682-3번지,경기도 용인시 처인구 이동면 경기동로 688,37.1396153,127.1964892
용인시,모현파출소,경기남부청,용인동부,파출소,17035,경기도 용인시 처인구 모현면 왕산리 805-1번지,경기도 용인시 처인구 모현면 백옥대로 2372,37.3352029,127.2495059
용인시,중앙지구대,경기남부청,용인동부,지구대,17049,경기도 용인시 처인구 김량장동 328-2번지 중앙지구대,경기도 용인시 처인구 금령로 18,37.2345462,127.1981516
용인시,구성파출소,경기남부청,용인서부,파출소,16919,경기도 용인시 기흥구 언남동 375-3번지 구성파출소,경기도 용인시 기흥구 구성로 68,37.2946248,127.1168234
용인시,보정지구대,경기남부청,용인서부,지구대,16900,경기도 용인시 기흥구 보정동 1255-3,경기도 용인시 기흥구 보정로 110,37.319404,127.1157101
용인시,흥덕파출소,경기남부청,용인동부,파출소,16953,경기도 용인시 기흥구 영덕동 967번지,경기도 용인시 기흥구 흥덕2로118번길 1,37.2783224,127.0744704
용인시,상갈파출소,경기남부청,용인동부,파출소,17064,경기도 용인시 기흥구 신갈동 68-2번지,경기도 용인시 기흥구 중부대로 380,37.2715476,127.109167
용인시,동백파출소,경기남부청,용인동부,파출소,17004,경기도 용인시 기흥구 중동 872-2번지,경기도 용인시 기흥구 동백6로 37,37.2774349,127.155382
용인시,원삼파출소,경기남부청,용인동부,파출소,17168,경기도 용인시 처인구 원삼면 고당리 71-6번지,경기도 용인시 처인구 원삼면 고당로15번길 1,37.1648361,127.311144
용인시,포곡파출소,경기남부청,용인동부,파출소,17028,경기도 용인시 처인구 포곡읍 삼계리 561-5번지,경기도 용인시 처인구 포곡읍 포곡로278번길 3,37.2792936,127.2320378
용인시,남사파출소,경기남부청,용인동부,파출소,17118,경기도 용인시 처인구 남사면 봉무리 664-4번지,경기도 용인시 처인구 남사면 처인성로185번길 13,37.1137049,127.1499675
용인시,고매파출소,경기남부청,용인동부,파출소,17102,경기도 용인시 기흥구 고매동 산80-2번지,경기도 용인시 기흥구 동탄기흥로 715,37.2231619,127.0989698
용인시,구갈지구대,경기남부청,용인동부,지구대,16962,경기도 용인시 기흥구 신갈동 164-3번지,경기도 용인시 기흥구 관곡로 41,37.2831787,127.1105253
의왕시,내손파출소,경기남부청,의왕,파출소,16039,경기도 의왕시 내손동 759번지,경기도 의왕시 갈미로 77,37.3786694,126.9757281
의왕시,청계파출소,경기남부청,의왕,파출소,16009,경기도 의왕시 청계동 992번지,경기도 의왕시 안양판교로 227,37.3894214,126.9963325
의왕시,부곡파출소,경기남부청,의왕,파출소,16082,경기도 의왕시 삼동 460-95번지,경기도 의왕시 한백이길 3,37.3223377,126.9489308
의왕시,의왕지구대,경기남부청,의왕,지구대,16053,경기도 의왕시 오전동 839-8번지,경기도 의왕시 경수대로 352,37.3567818,126.9679816
의정부시,신곡지구대,경기북부청,의정부,지구대,,경기도 의정부시  경의로 119번길,,,
의정부시,금오지구대,경기북부청,의정부,지구대,11779,경기도 의정부시 신곡동 804-1번지,경기도 의정부시 추동로108번길 1,37.7475452,127.0662853
의정부시,가능지구대,경기북부청,의정부,지구대,11660,경기도 의정부시 가능동 238-6번지 가능지구대,경기도 의정부시 호국로 1171,37.7432336,127.0337649
의정부시,호원파출소,경기북부청,의정부,파출소,11714,경기도 의정부시 호원동 465-3번지 호원파출소,경기도 의정부시 평화로 159,37.7059654,127.0478451
의정부시,송산파출소,경기북부청,의정부,파출소,11809,경기도 의정부시 민락동 743-1번지,경기도 의정부시 용민로 119,37.7399078,127.0901264
이천시,율면파출소,경기남부청,이천,파출소,17423,경기도 이천시 율면 고당리 247-12번지,경기도 이천시 율면 고당로 144,37.0954107,127.5468183
이천시,설성파출소,경기남부청,이천,파출소,17411,경기도 이천시 설성면 금당리 126-5번지,경기도 이천시 설성면 설장로17번길 6-1,37.1326218,127.5210996
이천시,신둔파출소,경기남부청,이천,파출소,17303,경기도 이천시 신둔면 수광리 271-2번지 신둔파출소,경기도 이천시 신둔면 경충대로 3162,37.3086289,127.4024101
이천시,부발파출소,경기남부청,이천,파출소,17324,경기도 이천시 부발읍 무촌리 195-3번지,경기도 이천시 부발읍 무촌로 167-5,37.2868522,127.4888777
이천시,모가파출소,경기남부청,이천,파출소,17408,경기도 이천시 모가면 진가리 114-26번지,경기도 이천시 모가면 진상미로 1303,37.1721506,127.4802717
이천시,창전지구대,경기남부청,이천,지구대,17365,경기도 이천시 창전동 152-19번지,경기도 이천시 영창로 171,37.2816578,127.4415981
이천시,호법파출소,경기남부청,이천,파출소,17394,경기도 이천시 호법면 후안리 265-1번지,경기도 이천시 호법면 이섭대천로 547,37.2240863,127.4281605
이천시,백사파출소,경기남부청,이천,파출소,17312,경기도 이천시 백사면 현방리 99-38번지 백사파출소,경기도 이천시 백사면 현방로 62,37.3384618,127.4911736
이천시,장호원파출소,경기남부청,이천,파출소,17420,경기도 이천시 장호원읍 장호원리 99-4번지 장호원파출소,경기도 이천시 장호원읍 장감로 70,37.1167668,127.6304451
이천시,아미파출소,경기남부청,이천,파출소,17332,경기도 이천시 부발읍 아미리 1076번지,경기도 이천시 부발읍 경충대로 2154,37.2571651,127.4863198
이천시,대월파출소,경기남부청,이천,파출소,17343,경기도 이천시 대월면 초지리 310-2번지,경기도 이천시 대월면 대월로803번길 64,37.2246128,127.4946527
이천시,마장파출소,경기남부청,이천,파출소,17387,경기도 이천시 마장면 오천리 291-2번지,경기도 이천시 마장면 오천로 27,37.2541874,127.3516695
이천시,증포파출소,경기남부청,이천,파출소,17348,경기도 이천시 증포동 157-4번지,경기도 이천시 갈산로 19,37.2894635,127.4552098
파주시,파주파출소,경기북부청,파주,파출소,10835,경기도 파주시 파주읍 파주리 431-1번지,경기도 파주시 파주읍 향교말길 26,37.8328596,126.8158151
파주시,파평파출소,경기북부청,파주,파출소,10801,경기도 파주시 파평면 금파리 303-1번지 파평파출소,경기도 파주시 파평면 청송로 198,37.922484,126.8397222
파주시,월롱파출소,경기북부청,파주,파출소,10946,경기도 파주시 월롱면 위전리 430-5번지 월롱파출소,경기도 파주시 월롱면 휴암로 3,37.7955816,126.7909878
파주시,금촌지구대,경기북부청,파주,지구대,10930,경기도 파주시 아동동 356-3번지,경기도 파주시 새꽃로 212,37.765669,126.7758767
파주시,탄현파출소,경기북부청,파주,파출소,10858,경기도 파주시 탄현면 축현리 492-3번지 탄현파출소,경기도 파주시 탄현면 방촌로 669,37.8038343,126.7183267
파주시,교하파출소,경기북부청,파주,파출소,10867,경기도 파주시 교하동 산16-4번지,경기도 파주시 교하로 1431-2,37.7521751,126.7504892
파주시,광탄파출소,경기북부청,파주,파출소,10948,경기도 파주시 광탄면 신산리 221-12번지,경기도 파주시 광탄면 동거리길 25-7,37.7813913,126.8488076
파주시,법원파출소,경기북부청,파주,파출소,10826,경기도 파주시 법원읍 법원리 449-9번지,경기도 파주시 법원읍 사임당로905번길 40,37.8489445,126.8797759
파주시,문산파출소,경기북부청,파주,파출소,10823,경기도 파주시 문산읍 문산리 31-3번지,경기도 파주시 문산읍 개포래로 50-4,37.8538584,126.7833104
파주시,적성파출소,경기북부청,파주,파출소,10803,경기도 파주시 적성면 마지리 48-2번지,경기도 파주시 적성면 청송로 1003,37.9533233,126.9168874
파주시,운정파출소,경기북부청,파주,파출소,10902,경기도 파주시 동패동 1895번지 운정파출소,경기도 파주시 한울로 55-1,37.7114882,126.7382658
