시흥시,군자,경기남부청,시흥,파출소,15068,경기도 시흥시 거모동 1757-6번지,경기도 시흥시 군자로 513,37.3442249473,126.7852995995
시흥시,대야,경기남부청,시흥,파출소,14909,경기도 시흥시 대야동 494번지,경기도 시흥시 호현로 42,37.4442639870,126.7853831598
시흥시,시화,경기남부청,시흥,파출소,15063,경기도 시흥시 정왕동 1785-4번지,경기도 시흥시 중심상가로 271,37.3400322370,126.7435807039
시흥시,능곡,경기남부청,시흥,파출소,14992,경기도 시흥시 능곡동 613번지,경기도 시흥시 장현능곡로 211,37.3690246931,126.8137442543
안산시,와동,경기남부청,안산단원,파출소,15335,경기도 안산시 단원구 고잔동 515번지,경기도 안산시 단원구 화랑로 397,37.3220367740,126.8315185050
안산시,선부,경기남부청,안산단원,파출소,15245,경기도 안산시 단원구 와동 79-2번지,경기도 안산시 단원구 선부로 323,37.3433330752,126.8289422289
안산시,선부3,경기남부청,안산단원,파출소,15220,경기도 안산시 단원구 선부동 703-3번지,경기도 안산시 단원구 선여불로 19,37.3439783575,126.8038872707
안산시,원선,경기남부청,안산단원,파출소,15375,경기도 안산시 단원구 원곡동 753번지,경기도 안산시 단원구 원곡공원로 30,37.3325553594,126.7945181365
안산시,공단,경기남부청,안산단원,파출소,15645,경기도 안산시 단원구 대부북동 294-6번지,경기도 안산시 단원구 대부중앙로 67,37.2449536754,126.5825241375
안산시,본오,경기남부청,안산상록,지구대,15532,경기도 안산시 상록구 본오동 877-3번지,경기도 안산시 상록구 상록수로 12,37.3025958394,126.8611027590
안산시,일동,경기남부청,안산상록,파출소,15323,경기도 안산시 상록구 일동 600-6번지,경기도 안산시 상록구 호동로 118,37.3125920254,126.8643553807
안산시,수암,경기남부청,안산상록,파출소,15202,경기도 안산시 상록구 수암동 502번지,경기도 안산시 상록구 수인로 2026,37.3639184263,126.8763734738
안산시,부곡,경기남부청,안산상록,파출소,15306,경기도 안산시 상록구 부곡동 671-11번지,경기도 안산시 상록구 성호로 324,37.3315362560,126.8608001550
안산시,호수,경기남부청,안산단원,지구대,15335,경기도 안산시 단원구 고잔동 514번지,경기도 안산시 단원구 화랑로 373,37.3216184207,126.8288569017
안산시,고잔,경기남부청,안산단원,파출소,15473,경기도 안산시 단원구 고잔동 712-3번지,경기도 안산시 단원구 광덕2로 127,37.3101693081,126.8247208649
안산시,선부2,경기남부청,안산단원,파출소,15367,경기도 안산시 단원구 선부동 1072-5번지,경기도 안산시 단원구 선부광장1로 150,37.3319224126,126.8091095027
안산시,원곡,경기남부청,안산단원,파출소,15212,경기도 안산시 단원구 선부동 1135번지,경기도 안산시 단원구 선삼로2길 14-20,37.3448666907,126.8126086013
안산시,대부,경기남부청,안산단원,파출소,15380,경기도 안산시 단원구 원곡동 821-3번지,경기도 안산시 단원구 원선로 33,37.3280009302,126.7972160565
안산시,신길,경기남부청,안산단원,파출소,15433,경기도 안산시 단원구 원시동 773-6번지,경기도 안산시 단원구 동산로 29,37.3128119822,126.7933543238
안산시,사동,경기남부청,안산상록,지구대,15582,경기도 안산시 상록구 사동 1304-1번지,경기도 안산시 상록구 석호로 175,37.2967630108,126.8512451982
안산시,반월,경기남부청,안산상록,파출소,15520,경기도 안산시 상록구 건건동 47,,37.3190938656,126.9061193430
안산시,본오1,경기남부청,안산상록,파출소,15575,경기도 안산시 상록구 본오동 1153-1번지,경기도 안산시 상록구 샘골로 11,37.2848124221,126.8634590897
안산시,월피,경기남부청,안산상록,파출소,15259,경기도 안산시 상록구 월피동 512-3번지,경기도 안산시 상록구 안산천서로 215,37.3330587229,126.8463202764
안산시,성포,경기남부청,안산상록,파출소,,경기도 안산시 상록구 예술광장1로 78,,,
안산시,팔곡,경기남부청,안산상록,파출소,15526,경기도 안산시 상록구 팔곡일동 681-1번지,경기도 안산시 상록구 소학길 8,37.2975063677,126.8871541584
안성시,공도,경기남부청,안성,지구대,17560,경기도 안성시 공도읍 만정리 793-2번지,경기도 안성시 공도읍 공도4로 4,37.0006636883,127.1726677761
안성시,내리,경기남부청,안성,파출소,17546,경기도 안성시 대덕면 내리 676-1번지,경기도 안성시 대덕면 대학6길 34,37.0036658055,127.2261523213
안성시,죽산,경기남부청,안성,파출소,17519,경기도 안성시 죽산면 죽산리 432-7번지,경기도 안성시 죽산면 죽주로 241,37.0748511138,127.4219729571
안성시,보개,경기남부청,안성,파출소,17509,경기도 안성시 보개면 불현리 42-9번지,경기도 안성시 보개면 보개원삼로 220-1,37.0224688909,127.2900144310
안성시,양성,경기남부청,안성,파출소,17502,경기도 안성시 양성면 동항리 291-3번지,경기도 안성시 양성면 장터길 35,37.0586847541,127.1952716274
안성시,대덕,경기남부청,안성,파출소,17545,경기도 안성시 대덕면 건지리 420-4번지,경기도 안성시 대덕면 중앙로 78,37.0125826239,127.2374370245
안성시,금광,경기남부청,안성,파출소,17535,경기도 안성시 금광면 금광리 93-5번지,경기도 안성시 금광면 금광초교길 38,37.0009669458,127.3227268473
안성시,원곡,경기남부청,안성,파출소,17556,경기도 안성시 원곡면 외가천리 267-4번지,경기도 안성시 원곡면 가천중앙1길 44,37.0391573244,127.1292543243
안성시,일죽,경기남부청,안성,파출소,17529,경기도 안성시 일죽면 송천리 20-6번지,경기도 안성시 일죽면 주래본죽로 28,37.0935727589,127.4775513079
안성시,중앙,경기남부청,안성,지구대,17578,경기도 안성시 석정동 256-2번지,경기도 안성시 석정1길 15,37.0094409868,127.2619548743
안양시,인덕원,경기남부청,안양동안,지구대,13930,경기도 안양시 동안구 관양동 1730번지,경기도 안양시 동안구 동편로 190,37.4060767594,126.9700822389
안양시,호계,경기남부청,안양동안,파출소,14123,경기도 안양시 동안구 호계동 1006-9번지,경기도 안양시 동안구 경수대로508번길 17,37.3681405668,126.9588436509
안양시,평안,경기남부청,안양동안,파출소,14068,경기도 안양시 동안구 평촌동 896-5번지,경기도 안양시 동안구 관평로138번길 43,37.3903614783,126.9644768097
안양시,명학,경기남부청,안양만안,지구대,14033,경기도 안양시 만안구 안양동 441-1번지,경기도 안양시 만안구 안양로170번길 20,37.3895256277,126.9304764679
안양시,갈산,경기남부청,안양동안,지구대,14106,경기도 안양시 동안구 호계동 1118-1번지,경기도 안양시 동안구 흥안대로223번길 30-1,37.3762251619,126.9662001287
안양시,석수,경기남부청,안양만안,지구대,13958,경기도 안양시 만안구 안양동 42-17번지,경기도 안양시 만안구 경수대로 1161,37.4146376941,126.9183656320
안양시,안양,경기남부청,안양만안,지구대,13992,경기도 안양시 만안구 안양동 88-1번지,경기도 안양시 만안구 만안로 232,37.4049710741,126.9200367829
안양시,범계,경기남부청,안양동안,파출소,14072,경기도 안양시 동안구 호계동 1051-2번지,경기도 안양시 동안구 평촌대로217번길 57,37.3898074885,126.9527896368
안양시,비산,경기남부청,안양동안,지구대,13922,경기도 안양시 동안구 비산동 459-57번지,경기도 안양시 동안구 관악대로 125,37.3990265896,126.9379211101
안양시,박달,경기남부청,안양만안,지구대,14008,경기도 안양시 만안구 박달동 94-136번지,경기도 안양시 만안구 박달로 492,37.4022762961,126.9070967163
양주시,고읍,경기북부청,양주,파출소,11493,경기도 양주시 만송동 695-3번지,경기도 양주시 고읍로 83,37.7964221513,127.0807578428
양주시,주내,경기북부청,양주,파출소,11496,경기도 양주시 마전동 163-3번지,경기도 양주시 부흥로 1613,37.7790676596,127.0512606332
양주시,장흥,경기북부청,양주,파출소,11520,경기도 양주시 장흥면 일영리 139-4번지,경기도 양주시 장흥면 호국로 179,37.7169854230,126.9407747826
양주시,광적,경기북부청,양주,파출소,11419,경기도 양주시 광적면 가납리 741-2번지,경기도 양주시 광적면 가래비길 54,37.8233128812,126.9861062201
양주시,백석,경기북부청,양주,파출소,11504,경기도 양주시 백석읍 오산리 36-5번지,경기도 양주시 백석읍 꿈나무로 142,37.7964201979,126.9904608234
양주시,덕계,경기북부청,양주,파출소,11442,경기도 양주시 덕계동 681-31번지,경기도 양주시 평화로 1427,37.8181979557,127.0456757143
양주시,은현,경기북부청,양주,파출소,11427,경기도 양주시 은현면 선암리 336-3번지,경기도 양주시 은현면 은현로55번길 6,37.8740261913,127.0233174910
양주시,남면,경기북부청,양주,파출소,11404,경기도 양주시 남면 신산리 285-183번지,경기도 양주시 남면 개나리길 50,37.8951873811,126.9740956373
양주시,회천,경기북부청,양주,지구대,11451,경기도 양주시 덕정동 206-3번지,경기도 양주시 회정로 133,37.8375850522,127.0679527768
양평군,강하,경기남부청,양평,파출소,12574,경기도 양평군 강하면 운심리 34-4번지,경기도 양평군 강하면 운심길 46,37.4958274451,127.4111286450
양평군,개군,경기남부청,양평,파출소,12568,경기도 양평군 개군면 하자포리 223-1번지,경기도 양평군 개군면 하자포길 25,37.4252876637,127.5378642988
양평군,지평,경기남부청,양평,파출소,12541,경기도 양평군 지평면 지평리 539번지,경기도 양평군 지평면 지평의병로 91,37.4752483575,127.6361320716
양평군,단월,경기남부청,양평,파출소,12529,경기도 양평군 단월면 보룡리 92-1번지,경기도 양평군 단월면 재인동길 2-6,37.5328533440,127.6742929623
양평군,옥천,경기남부청,양평,파출소,12507,경기도 양평군 옥천면 옥천리 746-2번지,경기도 양평군 옥천면 옥천길 27,37.5183563353,127.4568705650
양평군,청운,경기남부청,양평,파출소,12530,경기도 양평군 청운면 용두리 659-3번지,경기도 양평군 청운면 용두로 140,37.5541047579,127.7087054418
양평군,용문,경기남부청,양평,파출소,12521,경기도 양평군 용문면 다문리 720-1번지,경기도 양평군 용문면 용문로 351,37.4840589981,127.5928018123
양평군,서종,경기남부청,양평,파출소,12503,경기도 양평군 서종면 문호리 779-2번지,경기도 양평군 서종면 무내미길 45,37.6032068306,127.3519561400
양평군,양서,경기남부청,양평,파출소,12585,경기도 양평군 양서면 양수리 559-6번지,경기도 양평군 양서면 양수로152번길 6,37.5447626439,127.3191853265
양평군,양근,경기남부청,양평,파출소,12555,경기도 양평군 양평읍 양근리 280번지,경기도 양평군 양평읍 해오름길 11,37.4881114703,127.4904838281
양평군,양동,경기남부청,양평,파출소,12539,경기도 양평군 양동면 쌍학리 228-5번지,경기도 양평군 양동면 학둔지아래길 72,37.4204249783,127.7528950340
양평군,강상,경기남부청,양평,파출소,12572,경기도 양평군 강상면 교평리 449-7번지,경기도 양평군 강상면 양평대교길 91,37.4821606318,127.4849504383
여주시,홍문,경기남부청,여주,지구대,12622,경기도 여주시 홍문동 15-2번지,경기도 여주시 세종로 2,37.2974962617,127.6368043796
여주시,산북,경기남부청,여주,파출소,12603,경기도 여주시 산북면 상품리 27-6번지,경기도 여주시 산북면 금품1로 2,37.4047283307,127.4436247986
여주시,가남,경기남부청,여주,파출소,12662,경기도 여주시 가남읍 태평리 176번지,경기도 여주시 가남읍 태평2길 23,37.2037037739,127.5453979690
여주시,능서,경기남부청,여주,파출소,12641,경기도 여주시 능서면 번도리 499-39번지,경기도 여주시 능서면 마장로 61,37.2991588235,127.5720572057
여주시,금사,경기남부청,여주,파출소,12604,경기도 여주시 금사면 이포리 198번지,경기도 여주시 금사면 이포로 41,37.3930667638,127.5341458278
여주시,대신,경기남부청,여주,파출소,12610,경기도 여주시 대신면 율촌리 283-2번지,경기도 여주시 대신면 여양로 1436,37.3750162994,127.5883114782
여주시,북내,경기남부청,여주,파출소,12613,경기도 여주시 북내면 당우리 161-1번지,경기도 여주시 북내면 여양2로 300,37.3293252644,127.6797438945
여주시,흥천,경기남부청,여주,파출소,12607,경기도 여주시 흥천면 효지리 376-23번지,경기도 여주시 흥천면 효자로 144,37.3326255078,127.5425323677
여주시,점동,경기남부청,여주,파출소,12667,경기도 여주시 점동면 청안리 128-2번지,경기도 여주시 점동면 청안로 118,37.2049523591,127.6616674147
여주시,강천,경기남부청,여주,파출소,12616,경기도 여주시 강천면 간매리 313번지,경기도 여주시 강천면 강문로 566,37.2735863939,127.7109939243
연천군,군남,경기북부청,연천,파출소,11006,경기도 연천군 군남면 삼거리 400-16번지,경기도 연천군 군남면 군남로 413-6,38.0844996875,127.0187026330
연천군,백학,경기북부청,연천,파출소,11048,경기도 연천군 백학면 두일리 370번지,경기도 연천군 백학면 청정로 532-1,38.0296407981,126.9178803379
연천군,청산,경기북부청,연천,파출소,11023,경기도 연천군 청산면 초성리 187-7번지,경기도 연천군 청산면 평화로 229,37.9939582965,127.0697527447
연천군,왕징,경기북부청,연천,파출소,11044,경기도 연천군 왕징면 무등리 17-2번지,경기도 연천군 왕징면 왕산로28번길 3,38.0571398208,127.0130339314
연천군,신서,경기북부청,연천,파출소,11000,경기도 연천군 신서면 도신리 285-11번지,경기도 연천군 신서면 연신로 1153,38.1846791657,127.1070558483
연천군,연천,경기북부청,연천,파출소,11012,경기도 연천군 연천읍 차탄리 649번지,경기도 연천군 연천읍 문화로 67-1,38.0995583039,127.0772820209
연천군,전곡,경기북부청,연천,파출소,11031,경기도 연천군 전곡읍 전곡리 328-40번지,경기도 연천군 전곡읍 선사로 410,38.0254520957,127.0734714154
오산시,중앙,경기남부청,화성동부,파출소,18137,경기도 오산시 오산동 903-3번지,경기도 오산시 역광장로 70,37.1466666635,127.0679190407
오산시,궐동,경기남부청,화성동부,파출소,18115,경기도 오산시 궐동 13-7번지,경기도 오산시 오산로 371,37.1596427041,127.0661176308
오산시,오산,경기남부청,화성동부,지구대,18139,경기도 오산시 원동 813-13번지,경기도 오산시 운암로 11,37.1472837251,127.0759226347
오산시,세교,경기남부청,화성동부,파출소,18106,경기도 오산시 세교동 617-2번지,경기도 오산시 세마역로 5,37.1809981739,127.0439736363
용인시,포곡,경기남부청,용인동부,파출소,17028,경기도 용인시 처인구 포곡읍 삼계리 561-5번지,경기도 용인시 처인구 포곡읍 포곡로278번길 3,37.2792936364,127.2320378352
용인시,상현,경기남부청,용인서부,지구대,16859,경기도 용인시 수지구 상현동 197-3번지,경기도 용인시 수지구 심곡로 7,37.3060914126,127.0754668255
용인시,백암,경기남부청,용인동부,파출소,17178,경기도 용인시 처인구 백암면 백암리 459-3번지,경기도 용인시 처인구 백암면 백암로201번길 9,37.1644220875,127.3738863537
용인시,동부,경기남부청,용인동부,파출소,17154,경기도 용인시 처인구 마평동 858-5번지,경기도 용인시 처인구 경안천로 16,37.2345519686,127.2106490060
용인시,보라,경기남부청,용인동부,파출소,17080,경기도 용인시 기흥구 보라동 609-2번지,경기도 용인시 기흥구 한보라1로 42-3,37.2512929124,127.1087441230
용인시,보정,경기남부청,용인서부,지구대,16900,경기도 용인시 기흥구 보정동 1255-3번지,경기도 용인시 기흥구 보정로 110,37.3194040213,127.1157101074
용인시,구성,경기남부청,용인서부,파출소,16919,경기도 용인시 기흥구 언남동 375-3번지,경기도 용인시 기흥구 구성로 68,37.2946248403,127.1168234486
용인시,중앙,경기남부청,용인동부,지구대,17049,경기도 용인시 처인구 김량장동 328-2번지,경기도 용인시 처인구 금령로 18,37.2345462011,127.1981516550
용인시,구갈,경기남부청,용인동부,지구대,16962,경기도 용인시 기흥구 신갈동 164-3번지,경기도 용인시 기흥구 관곡로 41,37.2831787050,127.1105253086
용인시,고매,경기남부청,용인동부,파출소,17102,경기도 용인시 기흥구 고매동 산80-2번지,경기도 용인시 기흥구 동탄기흥로 715,37.2231619803,127.0989698231
용인시,모현,경기남부청,용인동부,파출소,17035,경기도 용인시 처인구 모현읍 왕산리 805-1번지,경기도 용인시 처인구 모현읍 백옥대로 2372,37.3352029018,127.2495059575
용인시,남사,경기남부청,용인동부,파출소,17118,경기도 용인시 처인구 남사면 봉무리 664-4번지,경기도 용인시 처인구 남사면 처인성로185번길 13,37.1137049633,127.1499675819
용인시,이동,경기남부청,용인동부,파출소,17136,경기도 용인시 처인구 이동읍 송전리 682-3번지,경기도 용인시 처인구 이동읍 경기동로 688,37.1396153765,127.1964892982
용인시,원삼,경기남부청,용인동부,파출소,17168,경기도 용인시 처인구 원삼면 고당리 71-6번지,경기도 용인시 처인구 원삼면 고당로15번길 1,37.1648361575,127.3111440864
용인시,동백,경기남부청,용인동부,파출소,17004,경기도 용인시 기흥구 중동 872-2번지,경기도 용인시 기흥구 동백6로 37,37.2774349369,127.1553820013
용인시,상갈,경기남부청,용인동부,파출소,17064,경기도 용인시 기흥구 신갈동 68-2번지,경기도 용인시 기흥구 중부대로 380,37.2715476743,127.1091670800
용인시,흥덕,경기남부청,용인동부,파출소,16955,경기도 용인시 기흥구 흥덕2로 8번길 1,,,
용인시,수지,경기남부청,용인서부,지구대,16833,경기도 용인시 수지구 풍덕천동 77-1번지,경기도 용인시 수지구 풍덕천로190번길 18,37.3248675650,127.1018859304
용인시,양지,경기남부청,용인동부,파출소,17158,경기도 용인시 처인구 양지면 양지리 445-3번지,경기도 용인시 처인구 양지면 양지로 165,37.2342497833,127.2867812651
의왕시,부곡,경기남부청,의왕,파출소,16082,경기도 의왕시 삼동 460-95번지,경기도 의왕시 한백이길 3,37.3222836971,126.9488970350
의왕시,의왕,경기남부청,의왕,지구대,16053,경기도 의왕시 오전동 839-8번지,경기도 의왕시 경수대로 352,37.3567818267,126.9679816972
의왕시,청계,경기남부청,의왕,파출소,16009,경기도 의왕시 청계동 992번지,경기도 의왕시 안양판교로 227,37.3894214765,126.9963663782
의왕시,내손,경기남부청,의왕,파출소,16039,경기도 의왕시 내손동 759번지,경기도 의왕시 갈미로 77,37.3786694763,126.9757281690
의정부시,가능,경기북부청,의정부,지구대,11660,경기도 의정부시 가능동 238-6번지,경기도 의정부시 호국로 1171,37.7432336326,127.0337649242
의정부시,금오,경기북부청,의정부,지구대,11779,경기도 의정부시 신곡동 804-1번지,경기도 의정부시 추동로108번길 1,37.7475452145,127.0662853832
의정부시,송산,경기북부청,의정부,파출소,11809,경기도 의정부시 민락동 743-1번지,경기도 의정부시 용민로 119,37.7399078984,127.0901264652
의정부시,신곡,경기북부청,의정부,지구대,11698,경기도 의정부시 의정부동 368번지,경기도 의정부시 경의로 119,37.7333180670,127.0491775598
의정부시,호원,경기북부청,의정부,파출소,11714,경기도 의정부시 호원동 465-3번지,경기도 의정부시 평화로 159,37.7059654572,127.0478451028
이천시,백사,경기남부청,이천,파출소,17312,경기도 이천시 백사면 현방리 99-38번지,경기도 이천시 백사면 현방로 62,37.3384618884,127.4911736050
이천시,장호원,경기남부청,이천,파출소,17420,경기도 이천시 장호원읍 장호원리 99-4번지,경기도 이천시 장호원읍 장감로 70,37.1167668246,127.6304451878
이천시,증포,경기남부청,이천,파출소,17348,경기도 이천시 증포동 157-4번지,경기도 이천시 갈산로 19,37.2894635274,127.4552098485
이천시,아미,경기남부청,이천,파출소,17332,경기도 이천시 부발읍 아미리 1076번지,경기도 이천시 부발읍 경충대로 2154,37.2572734185,127.4862867165
이천시,신둔,경기남부청,이천,파출소,17303,경기도 이천시 신둔면 수광리 271-2번지,경기도 이천시 신둔면 경충대로 3162,37.3086289513,127.4024101733
이천시,대월,경기남부청,이천,파출소,17343,경기도 이천시 대월면 초지리 310-2번지,경기도 이천시 대월면 대월로803번길 64,37.2246128906,127.4946527188
이천시,설성,경기남부청,이천,파출소,17411,경기도 이천시 설성면 금당리 126-5번지,경기도 이천시 설성면 설장로17번길 6-1,37.1326217554,127.5211221613
이천시,율면,경기남부청,이천,파출소,17423,경기도 이천시 율면 고당리 247-12번지,경기도 이천시 율면 고당로 144,37.0954107725,127.5468183864
이천시,모가,경기남부청,이천,파출소,17408,경기도 이천시 모가면 진가리 114-26번지,경기도 이천시 모가면 진상미로 1303,37.1721506301,127.4802717629
이천시,창전,경기남부청,이천,지구대,17365,경기도 이천시 창전동 152-19번지,경기도 이천시 영창로 171,37.2816578720,127.4415981542
이천시,부발,경기남부청,이천,파출소,17324,경기도 이천시 부발읍 무촌리 195-3번지,경기도 이천시 부발읍 무촌로 167-5,37.2868792280,127.4889005226
이천시,마장,경기남부청,이천,파출소,17387,경기도 이천시 마장면 오천리 59-12번지,경기도 이천시 마장면 오천로 101,37.2490802195,127.3571913966
이천시,호법,경기남부청,이천,파출소,17394,경기도 이천시 호법면 후안리 265-1번지,경기도 이천시 호법면 이섭대천로 547,37.2240863968,127.4281605069
파주시,파평,경기북부청,파주,파출소,10801,경기도 파주시 파평면 금파리 303-1번지,경기도 파주시 파평면 청송로 198,37.9224840938,126.8397222492
파주시,조리,경기북부청,파주,파출소,10937,경기도 파주시 조리읍 봉일천리 160-72번지,경기도 파주시 조리읍 봉천로 55,37.7437571527,126.8055107819
파주시,법원,경기북부청,파주,파출소,10826,경기도 파주시 법원읍 법원리 449-9번지,경기도 파주시 법원읍 사임당로905번길 40,37.8489445761,126.8797759594
파주시,교하,경기북부청,파주,파출소,10867,경기도 파주시 교하동 산16-4번지,경기도 파주시 교하로 1431-2,37.7521481672,126.7504893849
파주시,운정1,경기북부청,파주,파출소,10902,경기도 파주시 동패동 1895번지,경기도 파주시 한울로 55-1,37.7115155156,126.7383564764
파주시,적성,경기북부청,파주,파출소,10803,경기도 파주시 적성면 마지리 48-2번지,경기도 파주시 적성면 청송로 1003,37.9532873715,126.9169330081
파주시,파주,경기북부청,파주,파출소,10835,경기도 파주시 파주읍 파주리 431-1번지,경기도 파주시 파주읍 향교말길 26,37.8328596572,126.8158151758
파주시,운정2,경기북부청,파주,파출소,10893,경기도 파주시 목동동 657번지,경기도 파주시 해솔로 84,37.7281194302,126.7461810701
파주시,문산,경기북부청,파주,파출소,10823,경기도 파주시 문산읍 문산리 31-3번지,경기도 파주시 문산읍 개포래로 50-4,37.8538584832,126.7833104956
파주시,금촌,경기북부청,파주,지구대,10930,경기도 파주시 아동동 356-3번지,경기도 파주시 새꽃로 212,37.7656690228,126.7758767861
파주시,광탄,경기북부청,파주,파출소,10948,경기도 파주시 광탄면 신산리 221-12번지,경기도 파주시 광탄면 동거리길 25-7,37.7813913960,126.8488076119
파주시,탄현,경기북부청,파주,파출소,10858,경기도 파주시 탄현면 축현리 492-3번지,경기도 파주시 탄현면 방촌로 669,37.8038343482,126.7183267469
파주시,월롱,경기북부청,파주,파출소,10946,경기도 파주시 월롱면 위전리 430-5번지,경기도 파주시 월롱면 휴암로 3,37.7955816624,126.7910105783
평택시,서정,경기남부청,평택,지구대,17779,경기도 평택시 서정동 332-35번지,경기도 평택시 서정역로 34,37.0570447301,127.0560376208
평택시,서탄,경기남부청,평택,파출소,17704,경기도 평택시 서탄면 금암리 251-2번지,경기도 평택시 서탄면 서탄로 280,37.1080344116,127.0338427110
