평택시,만호,경기남부청,평택,파출소,17959,경기도 평택시 포승읍 만호리 578-8번지,경기도 평택시 포승읍 평택항로 170,36.9741598754,126.8437230361
평택시,청북,경기남부청,평택,파출소,17812,경기도 평택시 청북읍 현곡리 291-7번지,경기도 평택시 청북읍 신포길 38,37.0394570137,126.9341822915
평택시,안중,경기남부청,평택,파출소,17937,경기도 평택시 안중읍 현화리 823-3번지,경기도 평택시 안중읍 현화중앙길 71,36.9849968156,126.9205505767
평택시,송탄,경기남부청,평택,파출소,17753,경기도 평택시 신장동 211-7번지,경기도 평택시 탄현로 331,37.0817067457,127.0559761062
평택시,비전,경기남부청,평택,파출소,17887,경기도 평택시 비전동 819-1번지,경기도 평택시 평택5로 189,36.9962195844,127.1029187092
평택시,오성,경기남부청,평택,파출소,17819,경기도 평택시 오성면 숙성리 35-3번지,경기도 평택시 오성면 숙성시장길 71,37.0088754322,126.9855454225
평택시,신장,경기남부청,평택,파출소,17767,경기도 평택시 신장동 263-141번지,경기도 평택시 신서로 65,37.0723197533,127.0512241801
평택시,현덕,경기남부청,평택,파출소,17946,경기도 평택시 현덕면 도대리 17-107번지,경기도 평택시 현덕면 안현로 144,36.9646852732,126.9186298143
평택시,고덕,경기남부청,평택,파출소,17770,경기도 평택시 고덕면 좌교리 384-5번지,경기도 평택시 고덕면 고덕로 297,37.0431521542,127.0189786534
평택시,포승,경기남부청,평택,파출소,17965,경기도 평택시 포승읍 방림리 산73-4번지,경기도 평택시 포승읍 서동대로 1150,36.9822966773,126.8820286948
평택시,평택,경기남부청,평택,지구대,17891,경기도 평택시 통복동 73-1번지,경기도 평택시 중앙1로 23,36.9982693569,127.0855647599
평택시,팽성,경기남부청,평택,파출소,17990,경기도 평택시 팽성읍 객사리 47-3번지,경기도 평택시 팽성읍 동서촌로 93,36.9646371548,127.0624525287
평택시,진위,경기남부청,평택,파출소,17714,경기도 평택시 진위면 하북리 143-1번지,경기도 평택시 진위면 경기대로 1856,37.1100593243,127.0635337630
포천시,화현,경기북부청,포천,파출소,11123,경기도 포천시 화현면 화현리 810-19번지,경기도 포천시 화현면 화동로 327,37.8969745069,127.3014610397
포천시,영중,경기북부청,포천,파출소,11129,경기도 포천시 영중면 양문리 847-7번지,경기도 포천시 영중면 양문로 109,38.0025436481,127.2427636233
포천시,신북,경기북부청,포천,파출소,11139,경기도 포천시 신북면 기지리 893-2번지,경기도 포천시 신북면 호국로 2059,37.9333311977,127.2264090448
포천시,이동,경기북부청,포천,파출소,11111,경기도 포천시 이동면 장암리 219-2번지,경기도 포천시 이동면 화동로 2078,38.0330919210,127.3663104744
포천시,내촌,경기북부청,포천,파출소,11189,경기도 포천시 내촌면 내리 389-3번지,경기도 포천시 내촌면 내촌로 62,37.7854048978,127.2272455935
포천시,군내,경기북부청,포천,파출소,11152,경기도 포천시 군내면 구읍리 214-3번지,경기도 포천시 군내면 청군로 3280,37.8875254089,127.2181311803
포천시,소흘,경기북부청,포천,지구대,11175,경기도 포천시 소흘읍 송우리 726-75번지,경기도 포천시 소흘읍 태봉로 144,37.8304505946,127.1402013613
포천시,영북,경기북부청,포천,파출소,11105,경기도 포천시 영북면 운천리 505-2번지,경기도 포천시 영북면 운천로 4,38.0915848649,127.2738210413
포천시,가산,경기북부청,포천,파출소,11164,경기도 포천시 가산면 마산리 425-1번지,경기도 포천시 가산면 가산로309번길 13,37.8462560094,127.1846085116
포천시,관인,경기북부청,포천,파출소,11101,경기도 포천시 관인면 탄동리 664-2번지,경기도 포천시 관인면 관인로 15,38.1572485356,127.2504803211
포천시,일동,경기북부청,포천,파출소,11120,경기도 포천시 일동면 기산리 285-6번지,경기도 포천시 일동면 화동로 1023,37.9550743201,127.3156456821
포천시,창수,경기북부청,포천,파출소,11134,경기도 포천시 창수면 주원리 249-2번지,경기도 포천시 창수면 메치골로 174,37.9909016595,127.1892677658
포천시,포천,경기북부청,포천,파출소,11149,경기도 포천시 신읍동 106-22번지,경기도 포천시 원모루로1길 32,37.8925548230,127.1960794448
포천시,선단,경기북부청,포천,파출소,11160,경기도 포천시 선단동 834-2번지,경기도 포천시 송선로 279,37.8571152001,127.1503071717
하남시,덕풍,경기남부청,하남,지구대,12932,경기도 하남시 덕풍동 225-5,경기도 하남시 덕풍로81번길 13,37.5511503976,127.2041688453
하남시,하남,경기남부청,하남,지구대,12962,경기도 하남시 천현동 194-14번지,경기도 하남시 신장로 66,37.5355708982,127.2102252948
하남시,서부,경기남부청,하남,파출소,12990,경기도 하남시 감북동 327번지,경기도 하남시 감북로 43,37.5160671061,127.1620986877
하남시,창우,경기남부청,하남,파출소,12954,경기도 하남시 창우동 520-3번지,경기도 하남시 대청로 114,37.5391845267,127.2247294236
하남시,미사,경기남부청,하남,파출소,12910,경기도 하남시 망월동 952-1번지,경기도 하남시 아리수로 567,37.5675086848,127.1898943401
화성시,매송,경기남부청,화성서부,파출소,18287,경기도 화성시 매송면 어천리 426-1번지,경기도 화성시 매송면 화성로 2249,37.2498455955,126.9118999761
화성시,비봉,경기남부청,화성서부,파출소,18284,경기도 화성시 비봉면 양노리 255-3번지,경기도 화성시 비봉면 양노로 118,37.2368268260,126.8742646748
화성시,송산,경기남부청,화성서부,파출소,18550,경기도 화성시 송산면 사강리 638-1번지,경기도 화성시 송산면 송산포도로 98,37.2141018492,126.7380863975
화성시,우정,경기남부청,화성서부,파출소,18567,경기도 화성시 우정읍 조암리 265-3번지,경기도 화성시 우정읍 조암남로 31,37.0840621678,126.8184696440
화성시,발안,경기남부청,화성서부,파출소,18593,경기도 화성시 향남읍 평리 106-6번지,경기도 화성시 향남읍 3.1만세로 1096,37.1315264354,126.9073827794
화성시,동탄,경기남부청,화성동부,지구대,18460,경기도 화성시 석우동 59-1번지,경기도 화성시 노작로 226-1,37.2072742719,127.0773096677
화성시,마도,경기남부청,화성서부,파출소,18537,경기도 화성시 마도면 석교리 228-2번지,경기도 화성시 마도면 석교로 179,37.2061852467,126.7743866667
화성시,팔탄,경기남부청,화성서부,파출소,18527,경기도 화성시 팔탄면 구장리 529-5번지,경기도 화성시 팔탄면 서촌길 9,37.1603835439,126.9032148003
화성시,서신,경기남부청,화성서부,파출소,18555,경기도 화성시 서신면 매화리 351-3번지,경기도 화성시 서신면 매화1길 31,37.1701081927,126.7055876588
화성시,봉담,경기남부청,화성서부,파출소,18321,경기도 화성시 봉담읍 와우리 214-1번지,경기도 화성시 봉담읍 와우로15번길 17,37.2165468759,126.9705137452
화성시,남양,경기남부청,화성서부,파출소,18258,경기도 화성시 남양읍 남양리 651-8번지,경기도 화성시 남양읍 남양시장로 47,37.2089320755,126.8146064198
화성시,동탄2,경기남부청,화성동부,파출소,18472,경기도 화성시 영천동 668-1번지,경기도 화성시 동탄영천로 70,37.2089396516,127.1037507728
화성시,안용,경기남부청,화성동부,파출소,18362,경기도 화성시 안녕동 22번지,경기도 화성시 용주로32번길 4,37.2057474052,127.0132793437
화성시,양감,경기남부청,화성서부,파출소,18634,경기도 화성시 양감면 신왕리 678-5번지,경기도 화성시 양감면 은행나무로 263,37.0814791443,126.9448171612
화성시,태안,경기남부청,화성동부,지구대,18390,경기도 화성시 진안동 525-30번지,경기도 화성시 떡전골로 112-2,37.2083029182,127.0332527661
화성시,정남,경기남부청,화성동부,파출소,18516,경기도 화성시 정남면 괘랑리 921-1번지,경기도 화성시 정남면 만년로 582,37.1729394466,126.9839316122

